{
  "should_intervene": true,
  "intent_type": "plan",
  "confidence": 0.93,
  "title": "周五烤肉局",
  "suggested_trigger": "suggestion_chip",
  "summary": "群里对吃烤肉有明确兴趣，已有多人表示可以去，适合先确认参加意向。",
  "time_candidates": [
    "周五 18:30",
    "周五 19:00",
    "周五 19:30"
  ],
  "location_candidates": [
    "木屋烧烤",
    "韩宫宴"
  ],
  "participants": [
    {
      "name": "阿凯",
      "status": "positive"
    },
    {
      "name": "小雨",
      "status": "positive"
    },
    {
      "name": "老周",
      "status": "uncertain"
    },
    {
      "name": "大壮",
      "status": "neutral"
    },
    {
      "name": "奶茶不加糖",
      "status": "positive"
    }
  ],
  "missing_info": [
    "谁能参加",
    "最终时间",
    "最终地点"
  ],
  "suggested_bot_copy": "看起来已经有人可以去。我先帮大家确认去不去，人数稳定后再开时间和地点投票。",
  "chips": [
    "可以，先确认去不去",
    "再等一轮大家表态"
  ]
}
